<?xml version="1.0" encoding="UTF-8"?>
<xs:schema xmlns:xs="http://www.w3.org/2001/XMLSchema">
  <xs:element name="notebook">
    <xs:complexType>
      <xs:sequence>
        <xs:element name="record" minOccurs="0" maxOccurs="unbounded">
          <xs:complexType>
            <xs:sequence>
              <xs:element ref="first_name"/>
              <xs:element ref="father_name"/>
              <xs:element ref="last_name"/>
              <xs:element ref="address"/>
              <xs:element ref="date_of_birth"/>
              <xs:element ref="phones" minOccurs="0"/>
            </xs:sequence>
            <xs:attribute name="type" use="required">
              <xs:simpleType>
                <xs:restriction base="xs:string">
                  <xs:enumeration value="relative"/>
                  <xs:enumeration value="colleague"/>
                  <xs:enumeration value="acquaintance"/>
                </xs:restriction>
              </xs:simpleType>
            </xs:attribute>
            <xs:attribute name="id" type="xs:ID" use="required"/>
          </xs:complexType>
        </xs:element>
      </xs:sequence>
    </xs:complexType>
  </xs:element>


  <xs:element name="first_name" type="xs:string"/>
  <xs:element name="father_name" type="xs:string"/>
  <xs:element name="last_name" type="xs:string"/>
  <xs:element name="address">
    <xs:complexType>
      <xs:sequence>
        <xs:element name="place_of_living" type="xs:string"/>
        <xs:element name="street">
          <xs:complexType>
            <xs:simpleContent>
              <xs:extension base="xs:string">
                <xs:attribute name="number" type="xs:integer"/>
              </xs:extension>
            </xs:simpleContent>
          </xs:complexType>
        </xs:element>
      </xs:sequence>
      <xs:attribute name="post_code" type="xs:string" use="required"/>
    </xs:complexType>
  </xs:element>
  <xs:element name="date_of_birth" type="xs:date"/>
  <xs:element name="phones">
    <xs:complexType>
      <xs:sequence>
        <xs:element name="phone" minOccurs="0" maxOccurs="unbounded">
          <xs:complexType>
            <xs:simpleContent>
              <xs:extension base="xs:string">
                <xs:attribute name="type" use="required">
                  <xs:simpleType>
                    <xs:restriction base="xs:string">
                      <xs:enumeration value="personal"/>
                      <xs:enumeration value="work"/>
                    </xs:restriction>
                  </xs:simpleType>
                </xs:attribute>
              </xs:extension>
            </xs:simpleContent>
          </xs:complexType>
        </xs:element>
      </xs:sequence>
    </xs:complexType>
  </xs:element>
</xs:schema>